{
  "action": "PATCH",
  "affected_modules": [
    "mv_npu_top"
  ],
  "protected_modules": [
    "mv_ctrl_fsm",
    "mv_vec_buffer",
    "mv_mac16_core",
    "mv_postproc",
    "mv_stream_if"
  ],
  "protected_interfaces": [
    "clk",
    "rst_n",
    "cmd_valid",
    "cmd_ready",
    "cmd_data",
    "vec_valid",
    "vec_ready",
    "vec_data",
    "mat_valid",
    "mat_ready",
    "mat_data",
    "bias_valid",
    "bias_ready",
    "bias_data",
    "out_valid",
    "out_ready",
    "out_data",
    "status_busy",
    "status_error"
  ],
  "recommended_change": "In top-level control, make row-result handoff to postproc lossless and correctly timed: (1) register/hold completed row accumulator result until postproc accepts it, (2) assert `pp_in_valid` as a holdable valid (not a transient combinational pulse) and advance compute row/chunk progression only per existing protocol-consistent handshake strategy, and (3) ensure value presented to postproc corresponds to fully accumulated row sum (post-final-chunk accumulation), not pre-update accumulator state. Preserve current external ready/valid semantics and arithmetic rules.",
  "do_not_change": [
    "Do not modify frozen tests/reference model.",
    "Do not alter module port lists, parameters, or top-level interface semantics.",
    "Do not change INT8*INT8 and INT32 wrap arithmetic definitions.",
    "Do not edit protected modules; constrain fix to mv_npu_top integration/sequencing only."
  ],
  "expected_side_effects": [
    "Output count should match M with correct row ordering under backpressure.",
    "After fixing row handoff timing, any remaining arithmetic/control defects may become newly visible in regression."
  ],
  "regression_required": "FULL"
}
