{
  "action": "PATCH",
  "affected_modules": [
    "gemm8x8x32_bias_relu_top",
    "input_loader"
  ],
  "protected_modules": [
    "gemm_core_seq",
    "postproc_relu_bias",
    "output_streamer",
    "local_memories"
  ],
  "protected_interfaces": [
    "clk",
    "rst",
    "s_valid",
    "s_ready",
    "s_data",
    "s_type",
    "m_valid",
    "m_ready",
    "m_data",
    "busy",
    "done",
    "error"
  ],
  "recommended_change": "Align command handling with loader protocol: either (A) make input_loader explicitly consume CMD as first beat after start_load, or (B) keep CMD fully handled in top and ensure loader starts in A section without losing first A beat (e.g., assert start_load prior to first payload acceptance and gate s_ready/state transitions so first data beat cannot occur until loader ready). Preserve strict section ordering/count checks and sticky error semantics.",
  "do_not_change": [
    "Do not modify GEMM math, bias/ReLU semantics, or wrap behavior.",
    "Do not alter external interface signals/protocol meanings.",
    "Do not weaken protocol-error, reset, or backpressure behavior required by frozen tests.",
    "Do not change tests/reference artifacts."
  ],
  "expected_side_effects": [
    "Ingress timing of first beats will shift by ~1 cycle due to corrected start sequencing.",
    "Protocol error detection may trigger at correct earlier point for malformed streams instead of silent deadlock."
  ],
  "regression_required": "FULL"
}
