{
  "action": "PATCH",
  "affected_modules": [
    "postproc_relu_bias",
    "gemm_bias_relu_npu_top"
  ],
  "protected_modules": [
    "npu_control_fsm",
    "input_loader",
    "gemm_core",
    "output_streamer"
  ],
  "protected_interfaces": [
    "clk",
    "rst_n",
    "cmd_valid",
    "cmd_ready",
    "cmd_data",
    "a_valid",
    "a_ready",
    "a_data",
    "b_valid",
    "b_ready",
    "b_data",
    "bias_valid",
    "bias_ready",
    "bias_data",
    "out_valid",
    "out_ready",
    "out_data",
    "status_done",
    "status_error"
  ],
  "recommended_change": "Make `postproc_relu_bias` bias memory port use a compile-time constant unpacked dimension (e.g., bounded by MAX_N passed as a parameter) so it matches top-level `buf_bias` declaration. Keep runtime `cfg_n` only for index validity gating (`lane_active`/bounds checks), not for port sizing. Ensure the top-level instance parameterization and connection of `buf_bias` to `u_post.bias_mem` are type-compatible after this change.",
  "do_not_change": [
    "Do not modify architecture semantics of bias-by-n indexing, int32 add wrap, or ReLU behavior.",
    "Do not alter external top-level interface signals or handshake behavior.",
    "Do not edit frozen tests/reference artifacts.",
    "Do not perform broad rewrites of control/datapath modules unrelated to the elaboration error."
  ],
  "expected_side_effects": [
    "Elaboration/compile should proceed past current fatal errors.",
    "Existing width warnings may remain and can be handled in later iterations if they become blocking or functional issues."
  ],
  "regression_required": "FULL"
}
